text,label
아 그래? 유럽 어디쪽 생각하고 있어?,1
동유럽도 지역 많잖아 어디!?,1
조금이라도 주는게 어디야.,1
명절 선물은 어디서 사세요?,1
베트남 여행 가봤어? 어디어디 가봤어?,1
도시 어디 도시로 가봤는데?,1
어디 안 가네 승질 ㅠㅠ 키키,1
원피스 는 어디서 보는 거야?,1
그건 어디서 보능건데?,1
헐 대단하다 어디로 갔다왔어?,1
황치열이 어디서 유명해진거지?,1
제트스키 어디서 타? 가평?,1
얘들아 나 내일 운전연수 하는데 좋은 코스알아? 어디를 갈까~,1
저는 삼성페이 쓰는데 진짜 쇼핑몰이든 어디든 너무 편해요,1
나도 카페 좋아하는데 카페는 어디 추천해?,1
일본에 어디에 있어요?,1
헐? 진짜? 어디서?,1
어디서? 엄마가 전화했나?,1
밀푀유나베 밀키트 어디서 산거야?,1
어디 부분이 그렇게 좋아?,1
어디보자 전체 42권이라면 금방 보겠네^^,1
그런 황사는 어디서 오는 거길래 중국이 그래 심하노,1
어디가 좋아?,1
그건 어디서 할 수 있어,1
지금 어디 살아?,1
근데 어디 가?,1
뭐 어디 생각해 본 곳 있어?,1
어디 갔다 왔는데?,1
아아 키키 어디로 지원할 계획이야?,1
뭐 어디 다친 거야?,1
왜 어디가 아픈 거야~,1
보조제라도 챙겨먹는 게 어디야...,1
세금 무서워서 어디 이사 가겠어? 하하,1
그런가 하하 넌 어디가 더 좋은 거 같아?,1
오호 동해쪽 어디로?,1
강릉인가 어디 4단계였던걸로 아는데,1
군대 어디 다녀왔닝,1
근데 프러포즈는 어디서 한 줄 알아?,1
아... 제발~ 어디서 했는데? 키키,1
언니는 어디지?이편한?,1
또 어디서 뭘 보고 온거야 키키,1
맞다... 진짜 뭐 어디 한번만 가도 5만원 기본인데...,1
다들 바람 쐐러 어디로든 가는 거겠죠... 상상만 해도 부럽다,1
ㅜㅜ 그러게요... 그 차들은 밤에 다 어디로 가는가...,1
키키 그 차들은 다 어디 숨어 있다가 나오는가... 키키,1
너넨 어디든 둘만 있으면 되는 거 아니야?,1
어디서 결제할 수 있어?,1
오늘 뭐해? 어디 좋은데 가는거야?,1
더워서 어디 바다라도 들어가겠다.,1
나는 어디든 상관없음,1
너는 신체에서 가장 관심가는 외모가 어디야?,1
책 요즘에 어디서 사?,1
넌 그럼 어디서 싸게 한 거야? 예쁘던데,1
그니까 니는 어디서 산 거냐고 키키 알려달라니까,1
어디서 만나기로 했어?,1
그건 어디서 타려구요?,1
응 ㅜㅜ 그냥 어디론가 떠나고 싶은거 같애 키키,1
진주 어디든지 홈플러스에서 배달해 줘,1
오래 갈만한 옷들을 사려면 어디로 가야할까,1
두 회사중에 가라면 어디 가고 싶어?,1
그때 혜리가 군대 생활 했던 부대가 어디더라?,1
우리나라에 랜드마크가 어디라고 생각해?,1
그럼 제주도 안의 랜드마크는 어디일까,1
누나도 어디 갈 때 날씨 잘 보고 나가요,1
한의원에 어디 아파서 갔어?,1
그러니까요 ㅜㅜ 진짜 왜 어디서 그렇게 많이 발생하는지,1
오빠 곧 여행 간다며 어디감?,1
임영웅이 어디서 상금 받은 거 기부했대.,1
나는 그냥 걸어디니느게 좋아,1
연휴여서 어디든 사람 많았을꺼야.,1
갑자기 등산? 어디로?,1
해수욕장은 어디로가?,1
넌 어디갔었어?,1
새로운 시도한곳이어디야!,1
저기 어디냐 어디 프렌차이즈 햄버거 집도 군대식 햄버거 내놓지 않았었나?,1
조인성님 어디 나오셨죠...,1
궁금 궁금 조인성 어디 나왔지? 키키,1
어디 다친 곳은 없어?,1
언니는 나중에 독립하면 어디에 살고 싶어요? 키키,1
어디선가 들은이야기 같아,1
나도나도. 넌 코로나 끝나면은 어디로 갈꺼야?,1
키키 **가 하나 차려줘 ㅠ 그래도 걸을 곳 많은게 어디야,1
그래도 걸을 곳 많은게 어디야,1
어? 너 어디 살았어?,1
어디 숙소요?,1
어디로 가고 싶은데 키키,1
동네 어디로,1
어디로 입소해요?,1
어디 풋살장에서 하는데?,1
오빠랑 첫 해외 여행 어디로 갈까?,1
어디 좋은 곳 있어?,1
그걸 어디에 쓸수있노,1
보통 어디서 사는데?,1
난 없음 키키 행님은 어디,1
좋겠다ㅠㅠ 어디 놀러 가는 거야?,1
키키 어디있는건데,1
신기하다. 어디로 다녀왔어?,1
어디랑 경기했는데,1
언니 데뷔 못하면 죽는 병 어디까지 봤다고 했지?,1
어디 플랫폼에서 연재하는거야?,1
저번에 준 마스크 어디서 산거야,1
**님 어디 등산 간다고 했는데?,1
좋아 갈비 어디가 제일 맛있어?,1
그래도 자기 운동화 아닌 게 어디야 키키,1
어디 지역으로 구하셨대?,1
코로나가 끝나면 제일 먼저 어디를 가고 싶어?,1
맞아 어디 들어가는것도 좋아하고 색도 잘 변해,1
키키 어디 피자 시키셨습니까?,1
NBA는 어디팀이 잘할 것 같아?,1
강아지는 산책이 되고 어디든 데려갈 수 있으니까 다른 매력이 있지,1
너 고양이 간식 어디서 사냐,1
오홍 고롷구먼 우리 냥이 이제 주사 맞아야 하는데 어디가 좋은지 모르겠음,1
그래도 나오는게 어디에요,1
어디로 갑니까? 키키,1
아 키키 남친은 어디로 버렸습니까?,1
코로나 때문에 어디 가기도 그런데 딱이야.,1
완전 씩씩대면서 누난 어디가서 저러지 말라고 키키,1
캠핑 장비 어디서 구매했어요?,1
어디로?,1
너희는 어디 의느님 기술 도움 받고픈데 있니,1
어디였는데?,1
집 어디로 이사가요? 언제?,1
오호 근데 공명은 또 어디 나오나요?,1
요즘 남자 옷 쇼핑몰 어디가 제일 인기 많아?,1
어디 가서 잡았노?,1
오오 키키 지역은 어디로? 키키 1박으로 여행 갈 거야?,1
산업체 어디서 했다 그랬지?,1
어디 사이트에서?,1
근데 어디 놀러 가?,1
오키 그러면 나도 지금 봐야지 너 어디서 보는데?,1
캠핑은 어디로 가게?,1
그래? 어디로 갔어?,1
어디 아프기라도 한 거야?,1
요즘엔 어디 소원 빌 때 가족 건강 기원이 1번이야,1
어디서 샀어?,1
하하  오  어디야? 나도갈래,1
배우 누구 누구 나오는데? 어디서 하는 거지,1
아니 ㅠㅠ 마음 같아서는 어디든 가고 싶은데 여유가 없네 ㅠㅠ,1
안가 라고 하면 어디 가기 싫어하는 사람 같아,1
나는 둘 다 좋아 그냥 놀러 가면 어디든 좋아,1
키키 힐링 하러 가고 싶어 어디든지!,1
어디로 놀러 가야 잘 갔다고 소문이 날까,1
고가 자꾸 들어와 ㅠ 어디서,1
미친 어디든 쓰레기들은 넘쳐나는 군,1
아팠어? 어디가 이상했어?,1
운명의 짝 어디 계신가요...?,1
그럼 어디서 만날 수 있어? 요즘은?,1
오 거기는 어디야?,1
우리나라에서 가장 높은 빌딩이 어디니?,1
어디선가 안보이는 미사일 날라와서요,1
봄 가을 어디 갔는데 키키,1
어. 그래서 지난 번에 어디선가 선물 들어왔는데,1
우리집에서 먹던 건 어디꺼였지...,1
점 빼봤어요? 어디 싼데없을까요?,1
어디에요?,1
아니 지금도 어디 넘어져서 무릎 까져오는데 애기지...,1
다들 쇼핑몰 어디 거 이용해 ㅠㅠ,1
어디 가기로 했어?,1
그렇지. 어디서 듣기로는 전세계 3% 인구가 감염되었다던데.,1
"그런데 내 주변엔 코로나 감염자가 없는데, 자꾸 어디서 걸리는 지 모르겠어.",1
스우파는 어디서 해?,1
그래? 들어가는 게 어디야~ 못 들어오는 사람도 많다더라,1
어디로 가고 싶으세요,1
어디서 찍음?,1
어디 가서 그러지 마,1
성형 하면 어디 할래? 하하,1
어디더라... 집쿡 ?,1
어머 대박 어디서?,1
왜 어디서 받았어?,1
더욱이 농촌 어디서든 인터넷이 잘돼서 크게 불편함도 없어.,1
엥 아빠 운동을 어디로 가는 거야?,1
개 데리고 가기 좋은 여행지는 어디야?,1
이번에 추석에 너네 어디 가기로 했어?,1
왜? 너는 어디 가기로 했어?,1
옼 키키 어디로 가셨음?,1
신혼여행 어디로 다녀왔지?,1
난 지금 냉동 파먹기 하잖아 키키 많이 비움ㅋ 곰국은 어디껀데?엄마가해준거?,1
키키 어디서 까는 거냐 키키,1
어디로 가려고 날씨 좋음?,1
그걸 어디에다 쓰노ㅜㅜ,1
그런데 선물은 어디 갔어,1
좋죠 키키 여행 어디로 갈까요,1
*이는 어디 학교를 나왔니?,1
맞아 엄마랑 친구처럼 어디 다니고 하는거 너무 좋아,1
응~ 월급도 그대로고 어디 나라에서는 주 4일제 해보고 업무 생산성이 더 높아지기도 했다고 그러더라고,1
엉 계속 키웠지 정들어서 어디 못 보내겠더라,1
응응 어디루 갈래?  영화관,1
오늘 어디에서 경기 했는데?,1
하하 오 어디 나라건데?,1
와 진짜 예술이네 삼청동이가 어디공,1
일본의 랜드마크는 어디라고 생각하니?,1
신혼여행으로 갔던 괌 호텔이 어디였지?,1
너네는 유학을 갈 수 있다면 어디로 가고 싶어?,1
내년 봄에 벚꽃 구경 어디로 갈까~?,1
응응 그래서 상품권 신공 쓰려고 하는데 어디가 싸려나?,1
어디 것이 더 유명해?,1
그런 건 인터넷 어디서 보는데?,1
뭔가 어디 가도 다 한가하다고 해야 하나,1
덕산에 가면 어디 집에 누구 사는지 다 안다 키키,1
행님은 어디 나왔지?,1
맞아 가상화폐라는데 어디서 쓰는건지도 모르겠고,1
요즘 소풍 어디로 많이가?,1
장은 어디서 보는 편이 십니까?,1
어디에 쓸지 고민해봐야겠네,1
동네가 어디였지?,1
걔는 어디서든 잘자,1
오 정말 어디서?,1
근데어디인지 모르겟다,1
어디로 갔어? 나 전에 받아왔는데.,1
머리 어디서 자름?,1
어디로 가?,1
전 세계 어디든지 다 인력난인가봐ㅜㅜ,1
"네일이랑, 페디랑, 어디로 갈건데?",1
이게 어디서 그짓말이고,1
쌀 어디서 사는데 니가 그때 하필 딱 떠가 키키,1
어디서 놀아 키키 6인이섴 키키,1
웅웅 구니까 어디서 놀아 18시 이후에,1
강아지들은 어디를 산책하는 걸 제일 좋아해?,1
어디 다녀오셨나 봐요?,1
열두 시간인가 키키 기억 안 남 너는 해외여행 어디 갔다 왔어,1
인테리어 하면 어디부터 꾸미고 싶어?,1
너 군대 어디 나왔다고 했지,1
어디 가서 특전사라 하지 마라,1
닌 옷 어디서 사?,1
키키 롯데리아라도 있는게 어디오,1
오오. 잘 다녀왔어? 이번에는 어디로 갔었어?,1
하긴 어디 가기 딱 좋은 날씨긴 하다 키키,1
넌 가을에 어디 놀러가고싶어?,1
너희 겨울옷은 어디서 구매해?,1
키키 언니는 어디서 주로 사는데?,1
벚꽃 보러 어디 가는데?,1
다음엔 어디로 여행 가보고 싶어?,1
어디 여행을 가려고 모아?,1
오 좋다! 이사 가면 어디로 가는 거야?,1
맹방? 그건 어디에 있는 거야?,1
오... 쿠팡인가 어디서 그런 게 가능하다고 하더라고!,1
** 코로나 끝나면 어디 가고싶어,1
1 : ** 코로나 끝나면 어디 가고싶어,1
정말? 어디로 된 거야?,1
맞아 그거 의외로 문열때 어디 잘 안 부딪힌다더라고.,1
추울 때는 어디 가서 몸을 녹여야 하나~,1
너 여친이랑 어디 안 놀러 가냐,1
너넨 소풍 어디로 갔니,1
나는 어디든 다가,1
카드는 어디서 나는데,1
너 대학 어디 가?,1
그러니까요...좁은 땅에서 어디는 비 오고 어디는 맑고...,1
형은 어디 자동차 보험 들어 놨어?,1
너는 어디로 들어 놨는데?,1
와 어디로 들었었길래 키키,1
사이버 대응이 어디에서든 중요하군요,1
응... ㅜㅜ 어디가 아픈지도 모르니까 ㅜㅜ 아휴,1
유산균이라도 먹는 게 어디야 키키,1
어디 가서 나쁜 것만 배워 가지고 어떻게 알았어?,1
넌 해외여행 어디 가봤어?,1
어디 가고 싶어?,1
그냥 어디든 키키 일단 해외 나가보고 싶어 키키,1
어디든 여행 좀 가고 싶다 ㅠㅠ,1
창녕이 어디야? 좋대?,1
가을은 어디 가고 바로 겨울이냐구 ㅠㅠ,1
오빠야는 군대 어디 갔다 왔어?,1
udt 707중 어디가 더 멋져보여?,1
어디서 많이 들어본거 같은데,1
키키 어디에 기부해 밤 주워서,1
어디서 본거 같은데 정확히 모르겠네,1
몰라 나는 딱 여름에서 가을로 넘어가는 그 중간 어디쯤 다운됨,1
빵상은 어디 맞았음?,1
"키키 다덜 호랑이 기운이 어디서 나나,",1
가고 싶은 곳이 어디져?,1
짝만 나타나면 뭔들 어디든 좋겠네 키키,1
사과 어디에 있지?,1
걔는 스튜어디스 할 거래,1
가장 가고 싶은 해외 여행지가 어디야?,1
오 그러게 아프리카 어디 가고 싶어?,1
어디꺼 먹어?,1
어디가 더 좋았어?,1
삼다수 어디서 주문한 건데?,1
그것도 어디서 배우는 기술이겠지? 키키,1
좁은 집에 살림을 자꾸사서 어디둘라고,1
어디 아울렛?,1
어디 더운데 밖에 돌아다니노 키키,1
응 결혼기념일에 어디 놀러간데,1
난 첨에 어디서 진동 소리 계속 나서 내전화 오는줄 알았다니까!,1
그렇지. 처음부터 잘 하는 사람이 어디 있겠어.,1
헐 군인들이 어디서?,1
오빠는 제일 좋았던 여행지가 어디었어요?,1
잠은 어디서 자?,1
헐 대박 키키 어디로 이전 했대?,1
파주 어디 놀러가?,1
어디가 안 좋으시대요,1
어디서 열리는 회의인가요?,1
요즘은 입시를 어디서 할려나,1
그럼 어디 하려고 하는 거야?,1
코시국이라 참 어디 가기 어렵다 어려워,1
일일이 어디여 난 작심 1시간 키키,1
필러를 맞는다고? 어디에?,1
형 군대 어디 나오셨어요,1
으웩 키키 그럼 어디 갈 때 무조건 버스겠네?,1
아니 첨 들어 학교는 어디로 정했대?,1
오 잘됐네 어디서 한대?,1
어디 학교 나왔는데...,1
어디 학교 나오심?,1
라면 물은 어디서 끓여?,1
오빠는 오프라인 쇼핑몰을 어디 자주 가세요?,1
오 이번엔 어디로 이직이야?,1
아하 어디 직렬로 가는데?,1
태국이 어디 도망가는 것도 아니잖아. 사태 진정되는대로 푸켓 해변 다시 가자,1
어디서 했는데?,1
니는 기억에 남는 여행 장소가 어디야?,1
어디가 많이 안통하는거야?,1
여행 어디로 가는데?,1
왜 왜 먼데 헐헐 어디서,1
어디 배달의 민족?,1
그래서 지금 어디다가 신고할지 알아보는 중,1
어디에서 그런겨 학교에서?,1
처형은 어디로 일 하시라고,1
아니 엄마 처음 들어보는데 어디야?,1
어디서 샀는데?,1
어디로 가려고?,1
요새 진주 맛집 어디임?,1
오 어디 맛있더나?,1
양주 어디 다녀오라고?,1
요즘 미용실 어디가 좋아?,1
골고루 챙겨드시네요 어디서 사서 드신대요?,1
그렇네요. 저도 어디서 사야하나 뭘 사야하나 어렵더라구요~,1
그거 어디서 하는 건데를,1
넌 여행가면 어디에 돈을 제일 많이 써?,1
오늘 어디서 볼꺼야?,1
어디서 새끼 많이 낳았나 보네,1
신랑또 이 작은거를 어디다가 쓸라고 샀냐고 안그래도 잔소리 하는데 짜증나더라 ㅋ,1
키키 그래도 엄마가 해주는 게 어디야 ㅠㅠ,1
해외 어디 갔었어?,1
오 어디서?,1
어디 신청해 보려고?,1
응응 아무래도 그런 거 같아...그치만 차가 언제 어디서 올지도 모른다는 생각을 하고 신호를 지켜주면 좋겠어!,1
연어를 어디서 사와야하지... 코스트코?,1
키키 조기 축구 어디로,1
어디가 또 아파?,1
꼼팅이는 어디 아픈데는 없지?,1
어디로 갔니 우리 키키,1
어디 병원 갈 거임?,1
어디로 가려 했어?,1
난 잘 모르지만 어디든 좋아,1
어디서 할 수 있어?,1
깜짝 쿠폰 그거 어디다 쓰냐 흠냐리,1
응 그래서 어디 갈지 고민 중이야,1
그래서 어디로 갈 건데?,1
누님 어디까지 봤습니까? 키키 중간인가요?,1
이번에 월드시리즈는 어디가 우승할까?,1
네 그래요. 전 팔이나 다리 발이 한거 봤는데요. 또 어디 해요?,1
어디서 먹었어,1
어디로 한 바퀴 돌까?,1
어디든 안 보낼 수도 없고,1
배변 훈련은 어디서 시켜,1
어디서?  어디서 그랬는데?,1
하하 오 어디어디 말해봐,1
어디서 알아봤는데 싸게 나왔니?,1
그러게요 우리 날도 좋아졌으니 어디 놀러 갈까요?,1
뭐 어디 가면 주로 내가 운전하니깐 키키,1
어디 가면 할머니 소리 듣는다니까,1
오호 베이지도 어디나 잘 어울리고 좋죠,1
어디 가보고 싶은 데 없어?,1
아 어디가 특히 닮았어?,1
엥 고양이를 어디서 만났어,1
오 키키 작은 누나가 게임 좀 어디 다니나 보네?,1
키키 전주 여행 체크해둔다는게 체크 안했었나봐 그 어디에도,1
오빠는 어디갔는데?,1
등산 어디로 가고? 야외 활동 하는구나,1
갑자기 어디가 아프신건데?,1
이번 연휴에 어디 여행이라도 갈까 하는데...,1
어디쪽 생각하고 계세요?,1
배달앱으로 디저트도 어디가 좋을지 찾아봐야겠네,1
너 호텔은 어디서 예약해?,1
키키 그래도 혼자 하시는게 어디얔,1
키키 다 어디 건데,1
코로나 때문에 어디도 못 가지,1
오 그러면 논산 말고 어디로 간 거야?,1
어디 티비에서 하고 있니?,1
그래 오늘 어르신들 어디 가기 전에 또 가서 일해야지,1
부럽다... 어디서 어떻게 분양 받은 거야?,1
어디 회사 다니고 싶다,1
경영학이면 어디 취직해?,1
나 어디서 봤는데 여자는 30살 이전에 만들어진 근육으로 평생을 살아 간다던가? 그렇대,1
예를 들어 어디?,1
하하 오빤 어디쪽 좋아?,1
어디 생각해?,1
어디가 좋아 진주는,1
너네 혼자 여행 가봤어? 휴가쓰고 어디 떠날까봐 혼자,1
오스트리아 어디로 가고 싶은데?,1
오 어디어디 돌아보고 왔어? 하하,1
너는 어디서 살 예정이야?,1
오호 어디 브랜드꺼 보고 있어?,1
오오오 여기 어디야?,1
그것도 나쁘지 않지 어디서 사려고?,1
어디어디 가봤어?,1
그럼 너는 어디어디 가봤어?,1
주말에 어디 텐트치고 나갈때 가지고 나가서 하고 그래요,1
다들 어디서 장을 봐 ?,1
아 정말? 오빠는 어디서 직장 생활 했었어?,1
걘 어디 안 가더라,1
넌 요즘 나온 아이돌 어디까지 알아?,1
오~ 어디로 드라이브 다녀왔어?,1
헐... 폭우 온 데는 어디지,1
어디로 이사갈 계획이야?,1
요새 D.P. 때문에 군대 얘기가 많아서... 육군 해군 공군 중 어디 갈지 궁금~,1
국내 여행이라도 가고 싶은데 어디가 좋을까?,1
내가 타야 하는 버스가 지금 어디쯤에 있지?,1
다시 간다면 어디를 꼭 가고 싶어?,1
어디서 살아나 초파리 태어나는 거지,1
어디서 그렇게 태어나는 거야 정말,1
응 막혀도 5시간이면 어디든 가더라고.,1
먹방 여행이네. 또 어디가고싶은데?,1
그동안 기념일에 또 어디갔었지,1
어디가 아픈 거야 도대체,1
태국 어디를 갈 수 있어?,1
현실 크아 하러 어디로 여행을 갈까?,1
너 어디 갈 때?,1
그러니까 키키 돈은 자꾸 어디서 나서 1억씩이나 준대~,1
어디 아프면 다시 오래,1
왜 지금 지하철 타고 어디가?,1
진짜 비 오면 어디 나가기 너무 싫어 ㅠㅠ,1
**아 웹툰 어디회사 웹툰 많이봐?,1
어디서 분양 받은 거야?,1
어디서 일 한다고 그랬지?,1
오 어디서 한느데,1
유럽 어디야?,1
서유럽쪽 어디인데?,1
그런 ㅠㅠ 젊은 사람들 다 어디 간겨...,1
경력직만 뽑으면 신입은 어디서 경력을 쌓나!,1
그러게... 나도 알바 구해야 하는데 보통 다들 어디서 구해?,1
형은 인턴 어디서 하고 싶어?,1
갔던 곳 중에 어디가 가장 좋았어?,1
"니는 과일어디서사노? 아빠과일도 비싸고, 키키",1
셋이 어디 냇가나 걷는게 데이트지,1
그러다가 어디 길 잃어버리면?,1
여튼 버스나 택시 타고 어디 나가는 거 보다는 면허를 따 놓으면 좀 편하니까,1
응? 너 군대에서 어디 다쳤는데,1
어디서 보니까 다른 나라들은 다 마스크를 안 쓰고 있길래,1
하아 진짜 어디서 살아야 하나 키키,1
엉 마저 ㅜㅜ 어디로 가야 하까,1
뭘 알아야 어디가서 얘기라도 할텐데,1
어디더라 어딘지는 지금 막 생각이 안나는데 좌석이 보통 올라가 있잖아 그리고 앉으면 내려오고.,1
자동차 극장 어디로 갔어요?,1
어디로 이사했어?,1
요새 미용실 어디가 잘함?,1
요즘 머리는 어디가 잘 짜르나,1
부평이랑 주안 어디? 키키,1
부평에서 유명한 데가 어디가 있지,1
해외여행 가면 어디로 가고 싶어?,1
다들 애인 어디서 만났어?,1
헐 할머니 어디 계신데?,1
근데 어디든 차 없으면 좀 불편하지 않아?,1
맞아 어디든 멈춰도 다 좋더라,1
네 맞아여 저를 써줄 곳은 어디라도 있겠죠,1
어디 브랜드 말 하는 거야?,1
코로나로 어디 갈 수가 없어서요,1
그니께 키키 일본 어디 갔다 왔어?,1
나 그... 온천 유명한 데가 어디였지 ㅜㅜ!? 끝 부분!,1
훗카이도 ? 오키나와? 후쿠오카? 어디지?,1
만약에 휴일 있으면 어디로 갈래?,1
헐... 그래도 돈 다시 돌려 받은 게 어디고 ㅜㅜ 다행이다!,1
싸돌아다니는 사람은 어디에든지 있거든 키키,1
"아파트도 그려, 근데 어디 살던 이웃이 중요할 듯",1
나도 어디가 괜찮은 곳인지 찾아볼게.,1
응 대출장소는 어디든 상관 없음,1
어디로 또 여행 가고 싶은데?,1
요즘 먹거리는 어디서 구입하시는가?,1
어디까지 보셨나요?,1
맞아. 학교에서나 하지 어디서 피구를 하겠어.,1
계획 세우는게 어디야 키키,1
그러게 하고싶어? 어디에?,1
그래? 안하는데가 어디야?,1
뭐 어디 가고 싶은 데라도 있어?,1
그래서 어디 가고 싶은데?,1
그거 때문에 어디 갔나 봐,1
키키 이불에 안지리는게 어디야...,1
가을 느낄라면 어디로 가야 될까 였니? 언니?,1
아니 도대체 자기 피부가 어디가 어떻게 좋다는 건지 원 키키,1
있긴하지~그런데 여행이라기 보다는 혼자 어디 카페나 산책이나~,1
여행할 때 숙소 예약 어디서 해 둘 다?,1
어디서 어떻게 사려고?,1
코스모스 어디 많이 피어 있어?,1
넌 여행가면 주로 어디서 자?,1
거기서는 어디서 지내게?,1
오오! 강아지랑 여행 간 것 중에 젤 멀리는 어디까지 가봤어?,1
정촌 최고의 맛집은 어디져,1
어디로 가는거야?,1
콘서트 갈 때 그거 어디서 구하지?,1
어디로 가고 싶으세요?,1
단풍은 어디가 좋을까요?,1
월루하시던 지난날의 님은 어디에ㅠㅠ,1
어디든 떠나고 싶오 요즘 ㅠㅠ,1
크림 흔하다고?  어디 팔아?,1
운전면허만 있으면 어디든 갈 수 있어!,1
추자도가 어디얌,1
3101은 어디가려나...,1
여름에는 근데 그게 최고인것같아. 어디 나가는것보다.,1
여행은 어디로 가는 게 좋을까?,1
나도 가고 싶다 어디든,1
니 최고의 맛집 어디임,1
그러면 산 쪽이랑 바다 근처 중에 어디가 좋아?,1
나도 곧 이사해야하는데 어디로 가야 할지 고민이네 ㅠㅠ,1
그 아저씨 돈은 어디서 나는데? 키키,1
진짜 어디 무인도 들어가서 살아야 하나 봐,1
시간 별로 어디 갈지 정해두는 편! @!,1
요즘 여자친구는 어디서 만날 수 있을까...?,1
어디서 여자를 만나...,1
너는 해외여행 가면 어디로 가고 싶어?,1
이제 어디든 많이 올라 가겠죠?!,1
최근에 어디가셨어요?,1
에이 그래도 등록되는게 어디야.,1
키키 네 거기 가평이었나? 어디 그쪽인 것 같아요,1
요즘 어디 쇼핑 사이트가 좋냐?,1
아 맞네 그건 생각 못했네 백사장이면 어디가 좋지,1
그 뭐냐 그리스였나 하얀색 집에 파란색 지붕 같은 거 있는 바다 보이는 곳 어디였지,1
헤헤 담엔 어디로 가고싶어?,1
홍삼 당근이 어디에 좋아?,1
어디 집?,1
저런 건 어디서 사는 거임 하하,1
강아지는 어디다 맡기고 가야겠네요,1
언니는 어디 가봤어 좋은데~?,1
맞아 그 코인은 다 어디서 생기는거야,1
어디 꺼 먹었어,1
어디에 맞고 싶은데,1
헐? 어디서 직구 했어?,1
응 운동 어디?,1
대체 그런건 어디서 공부하는거야?,1
예전에 아빠 어디가 진짜 많이 봤는데,1
어디서 들은 이야기인가요? 저는 찬성입니다.,1
와 가디건 하나 15라니 어디냐;,1
브랜드는 어디꺼 쓰는거야?,1
포메라이언은 원산지가 어디인가요?,1
어디 한번 해봐. 절대 안 될걸.,1
어디로 가려고 이렇게 신나서 말하는 거야?,1
그래도 전세로 간게 어디야! 요새 전세도 완전 많이 올라서 구하기도 힘들다던데,1
동반여행가면 어디가 좋을까?,1
어디로 가고 싶노,1
어디 좀 맘 놓고 갈 수 있었음 좋겠어,1
다음에 어디가든 무조건 보드게임,1
어디 못 가여 강아지가 있어서,1
**는 진짜 어디 많이 가더라,1
그나저나 이사 가야 하는데 어디로 갈까 키키,1
어디 알아봐야 돼?,1
일기예보도 사이트마다 다르다던데 어디서 보셨나요?,1
모르는 사람이 어디 있니.,1
누나는 옷 어디서 사세요?,1
오 햄버거 어디꺼 ? 하하,1
내 짝은 어디있나. 외로운 마음이 조금 들어.,1
어디로 가냐!,1
언니 요즘 기초화장품 어디 꺼 쓰세요?,1
