text,label
나비드는 어디 대학을 다녔어,1
배우 신소민의 본관이 어디야,1
아산은 어디에 있는 곳이야,1
하칼테크어는 어디서 쓰는 언어야,1
카일리 미노그의 출신 국가가 어디야,1
아폴로 16호의 사령선이 전시된 곳은 어디야,1
400년에 신라의 요청으로 가야와 왜를 토벌하러 온 나라는 어디야,1
팔레스타인 영토에서 유일하게 팔레스타인 정부가 통치를 하지않는곳은 어디야,1
일본의 FBI라 불리는 기관은 어디야,1
유비의 새 근거지는 어디였지,1
강우규는 어디에서 사형당했어,1
쿠데타로 쫓겨난 알프레도는 어디로 망명했어,1
이비론 이름이 어디서 유래한 건지 알려줘,1
2012년 스피드스케이팅 월드컵 3차 대회는 어디서 열렸어,1
니세토 알칼라사모라는 어디에서 죽었어,1
크리스찬 베일은 어디 살아,1
친일파를 받아 들였다고 논란이 된 당은 어디야,1
1964년 올림픽 어디에서 열렸어,1
캐롤라이나 팬서스의 연고지가 어디야,1
마닐라 군사 재판은 어디서 열렸어,1
스몰 비어 프레스는 어디에 있는건지 아니,1
1972년 고디가 모타운 본사를 어디로 이전했어,1
북한에 조국해방전쟁승리기념탑이 건설된 곳은 어디야,1
판덴호헨반트의 국적은 어디야,1
광복회가 어디서 삼일절 행사를 진행해,1
Billie Jean이 특히 인기를 끌었던 나라가 어디야,1
케임브리지 플라톤 학파는 어디에서 탄생했어,1
시리아의 주한 대표부 외교 업무를 보고 있는 곳은 어디야,1
비욘세가 다닌 초등학교가 어디야,1
미생물자원센터는 어디의 부설기관이야,1
모세가 가른 바다가 어디야,1
2012년 하계 올림픽 개최지가 어디야,1
말린과 도리가 니모를 찾으러 간 곳이 어디야,1
벤제마가 청소년 국가대표로 활동한 나라가 어디야,1
북한규가 2016년까지 코치로 있었던 팀은 어디야,1
시람무렌 강은 어디에서 발원하지,1
슈트라우스는 나치의 강요로 어디를 사임했지,1
한상태가 졸업한 대학교가 어디야,1
포르쉐 카이엔이 생산되는 곳은 어디야,1
한네스 올로프 예스타가 박사학위를 받은 대학이 어디야,1
야구선수 채병용 공익근무한 곳이 어디야,1
장피에르 소바주는 어디 교수지,1
정치용은 현재 어디에서 일하고 있어,1
1952년 하계 올림픽 축구 우승국이 어디야,1
작가 사라마구는 어디서 태어났어,1
세계에서 가장 넓은 성이 어디지,1
가수 아리아나 그란데가 8살 때 연기했던 곳은 어디지,1
Black International인 아나키스트 인터내셔널은 어디에서 창립되었어,1
배우 문성근이 태어난 곳이 어디야,1
최초로 경제학과를 개설한 대학이 어디야,1
야구선수 전준우 소속 팀이 어디야,1
간사이 국제공항을 처음에는 어디에 지을려고했어,1
50센트가 태어난 곳이 어디지,1
교황 베네딕토 8세가 속해있는 가문은 어디야,1
폴 로빈 크루그먼은 어디 교수야,1
2018년 FLVB 세계 여자 배구 선수권 대회는 어디서 개최해,1
도시 기후 리더십 그룹 제 1차 총회에는 어디에서 개최됐어,1
유혁로의 본관이 어디야,1
1984년 센트럴리그의 우승팀은 어디지,1
세포내 공생설에 따르면 미토콘드리아는 어디서 유래한거야,1
테르마이 로마이 2는 어디서 촬영했어,1
에리크 빌헬름은 사후 어디에 안장되었어,1
아테네에서 민회는 원래 어디에서 열렸어,1
야마구치 현의 경제의 중심지가 어디지,1
이범석이 이승만 하야 후에 방문한 곳이 어디야,1
Fritz Von Unruh가 망명했던 나라는 어디야,1
슬로베니아가 분리되기 전 국가가 어디야,1
대외경제무역 대학교는 어디에 있어,1
동학농민운동이 일어났을 때 조선 정부는 어디에 도움을 청했어,1
1994년 월드컵은 어디서 열렸어,1
라이트 레일의 정의를 내린 곳이 어디야,1
프랑스에서는 디드로를 어디로 옮기자는 논의가 나오고 있어,1
미국의 테네시 협곡 개발사업국을 모방한 나라가 어디야,1
파블로 피카소 국적이 어디야,1
오늘날 일반적인 서유럽은 어디를 말하는지 알려줘,1
파르티아 제국 다음으로 생긴 나라가 어디야,1
삼국 시대 천민들이 살던 곳은 어디야,1
와이키키 해변은 미국 어디에 위치하고 있어,1
경마공원 외에 마권을 구매할 수 있는 곳이 어디지,1
1858년 베트남을 식민지로 삼은 나라는 어디야,1
캠프 토코아 폐쇄 후에 낙하산 강하 관련 훈련은 어디로 옮겨졌어,1
횡성은 어디에 있는거야,1
김원형 코치 소속 팀이 어디야,1
대웅전 관음보살 벽화는 어디에 있냐,1
허남성의 성도 소재지가 어디야,1
중국에서 가장 큰 만이 어디야,1
전주원의 소속팀은 어디야,1
모리타니 이슬람 공화국은 어디 있는 나라야,1
독일 뒤셀도르프를 연고지로 하는 축구 클럽이 어디야,1
이다해가 졸업한 대학교가 어디야,1
중국의 쌍간허는 어디를 흐르는 하천이야,1
조시모 교황이 사제들의 출입을 금지한 곳은 어디야,1
구 아이톨리아 지역은 어디야,1
왕멍은 어디로 유배 돼,1
폴리안삼지창박쥐는 어디에 살지,1
세계 여자 핸드볼 선수권 대회에서 가장 많이 우승한 나라는 어디야,1
정동하가 나온 고등학교가 어디야,1
마이클 에시엔이 첼시에 있을때 1년동안 임대되었던 팀이 어디야,1
나비드가 문화 칼럼을 기고했던 신문사가 어디더라,1
포퍼가 어디에 가입했지,1
르네 랄루는 어디서 사망했는지 알려줘,1
정철의 묘는 어디에 있어,1
미셸 베로프는 어디서 태어났어,1
삼체 문제는 어디에서 시작됐지,1
하타 슌로쿠는 12살 때 어디로 이사갔어,1
하대성 포지션이 어디야,1
네기시가 졸업한 대학교는 어디야,1
이니에스타 소속 팀이 어디야,1
롯데가 어디서부터 시작됬어,1
김육의 학파는 어디야,1
칭기즈 칸 이름을 딴 공항이 어디야,1
구도가 다녔던 대학원이 어디야,1
태조의 어진은 어디에서 볼 수 있어,1
일본 스모 협회 본부는 어디에 있어,1
가평군은 우리나라 어디에 있는 군이야,1
폴 파이어아벤트는 어디서 태어났어,1
앵그리버드 스페이스와 협력을 맺은 곳들이 어디야,1
병자호란 때 인조가 어디서 청나라에 맞섰지,1
동림수산의 통조림 공장은 어디있어,1
로자리오와 뱀파이어 칠석의 미스 요카이학원의 제조사가 어디야,1
월간 코믹 전격대왕은 어디서 펴내는 거야,1
일본 자위대는 어디 소속이야,1
다카가 어디야,1
쳰포 산은 어디있어,1
2011년의 오만 반정부 시위가 주로 진행된 곳은 어디야,1
히데트는 어디서 볼 수 있어,1
아우르가진스키 군은 어디에 있지,1
크리스토프 마르틴 빌란트가 태어난 곳은 어디지,1
NHK 뉴스7는 어디서 방송됐어,1
허각 소속사가 어디야,1
창원향교는 원래 어디에 있었어,1
앨드리치 브리랜드 법은 어디에 영향을 주었지,1
헤클러운트코흐 5호 기관단총은 어디서 생산하는 총이지,1
안티오키아 이외에 라틴 총대주교들이 임명된 곳은 어디지,1
톈진 폭발 사고는 어디서 일어났어,1
로이 킨은 어디 출신의 축구 선수야,1
백제 성왕은 수도를 어디로 옮겼어,1
푸들의 이름은 어디에서 유래했어,1
토우함대는 어디 출신이지,1
일본에서 세번째로 큰 섬은 어디야,1
미국 팰로앨토는 어디에 있는 지명이야,1
세계에서 2번째 공산주의 국가가 된 나라가 어디야,1
우즈벡은 달에 가도 장사를 할 사람들이다는 어디 속담이야,1
비트겐슈타인은 어디서 활동한 철학자야,1
가수 채의림 소속사가 어디야,1
스티븐 핑거가 태어난 지역은 어디야,1
한반도의 위치가 어디야,1
TED의 운영조직은 어디에 있어,1
리분희이 태어난 나라가 어디야,1
14세기 이후 오크어 공동체가 존재했던 곳은 이탈리아의 어디야,1
아우내장터 만세운동에서 사용된 태극기는 어디서 만든거지,1
광개토왕이 절을 세운 곳이 어디야,1
써브웨이의 본거지는 어디야,1
선제후 요한 빌헬름 동상은 어디에서 볼 수 있어,1
삼나무 원산지가 어디야,1
1900년 올림픽이 어디서 열렸어,1
에두아르트 바스가 1910년 어디 카바레에서 일했어,1
전주월드컵경기장은 어디 있어,1
애니메이션 유희왕은 어디서 방송했었지,1
2002년 동계올림픽 어디서 했어,1
자유의 마을은 어디에 있는거야,1
금강의 주요 지류가 어디야,1
충북대병원 어디에 있어,1
이탈리아 축구선수 안토니오 디 나탈레 출신지역이 어디야,1
메갈로폴리스는 어디에 있어,1
Lee Tzsche는 언제 어디서 발매되었는데,1
글렌 하딘이 태어난 곳이 어디야,1
박지성 축구센터는 어디에 있어,1
옹켈츠와 계약 관계였으며 극우 팬들을 끌어 모으려 한 음반사는 어디지,1
건담에서 라그랑제 포인트는 어디에 있어,1
에디슨 박물관은 어디에 있어,1
유엔 헌장을 작성한 회의는 어디서 열렸어,1
실크로드의 요중지가 어디지,1
진중권의 아내의 출신 국가가 어디야,1
프리미어리그 2012 13 시즌 우승팀은 어디야,1
알제리 어디 식민지였어,1
더럼 지역의 의회는 어디에 있어,1
러시아 축구 국가대표팀은 어디에서 관리해,1
죠죠의 기묘한 모험의 제작사가 어디야,1
이낙연 아들이 어깨 수술 받은 병원이 어디야,1
타블로의 소속사가 어디야,1
핑크베리의 본사는 어디에 있어,1
화홍문은 어디에 있어,1
뉴질랜드 최고 법원의 소재지는 어디야,1
카메룬 요리는 어디서 많은 영향을 받았지,1
타키가 카노에게 데려가달라고 한 곳은 어디야,1
와라 편의점 상품은 어디서 팔아,1
영월군은 어디에 있어,1
피닉스 계획은 어디서 제안한 거야,1
닛폰햄 파이터스의 홈구장이 어디야,1
요리스의 포지션은 어디야,1
논산천의 발원지가 어디야,1
아사돌라 알람이 어디 나라의 사람인지 알 수 있을까,1
서인도 제도가 어디야,1
깔때기귀박쥐속는 주로 어디에 살지,1
일본 최초의 신문이 어디야,1
산티콰트로 코로나티 성당은 어디에 있어,1
1974년 방영된 강남가족은 어디서 방송했어,1
윙스클럽의 스핀오프시리즈는 어디를 통해서 공개돼,1
수원시와 함께 수원컵 국제 청소년 축구대회를 개최하는 협회는 어디야,1
오스트레일리아에서 가장 오래된 대학은 어디야,1
세인트 루이스 위치가 어디야,1
2008년 하계올림픽 열린 도시가 어디야,1
김진우의 출생지 어디였어,1
안동MBC 본사 위치가 어디야,1
2015년 크레이닷티비와 업무협력 MOU를 체결한 회사는 어디야,1
타이얼좡 전투는 어디에서 일어난거야,1
로건 국제공항이 어디있는 공항이야,1
오가와 야스히로의 현재 소속이 어디야,1
레바논의 수도가 어디야,1
박산다라가 계약한 한국 회사가 어디야,1
중국의 수도는 어디야,1
주제 모리뉴 어디 감독이었어,1
태조 이성계의 위패를 모신 게 어디야,1
일본 배우 나가사와 마사미 고향이 어디야,1
2000년 하계 올림픽이 열린곳이 어디야,1
송윤아가 나온 대학은 어디야,1
다라지도는 어디에 있어,1
2008년 자유선진당과 합당을 선언한 당은 어디야,1
폴 쿠류가는 어디의 대통령이었어,1
USS 프랭클린호는 웜홀에 휘말려 어디에 불시착했지,1
테오도시우스 2세의 수도가 어디였지,1
1966년 월드컵은 어디서 열렸어,1
뉴욕 소방국의 본부는 어디에 있어,1
유럽에서 가장 먼저 축구를 시작한 나라는 어디야,1
축구선수 우카시 파비안스키 현재 소속팀이 어디야,1
미드 모던패밀리 방송하는 채널이 어디야,1
디오에타 곶은 어디에 있어,1
아프리카의 뿔에 위치한 나라는 어디야,1
호르헤 베르가라가 구단주를 맡고있는 팀은 어디야,1
원주대교의 양방향 통행은 어디와 어디를 말하는 거야,1
드라마 화옥공주 어디서 방송했어,1
EU의 시리아 제재에 반대한 나라가 어디야,1
패러모어 멤버들의 고향이 어디야,1
프리도스 어디서 HIMEM.EXE를 불러올 수 있어,1
현재 우쓰미의 소속이 어디야,1
세포내 공생설에 의하면 엽록체는 어디서 유래했어,1
이비아는 어디에 있는 마을이야,1
일본 야구팀 오릭스의 홈구장이 어디야,1
영화배우 앤드류 가필드의 국적이 어디야,1
아프리카의 경제 4위 국가는 어디야,1
타카하다 이사오의 출신 대학은 어디야,1
겐큐6년의 대규모의 야부사메를 개최한건 어디야,1
세르비아와 함께 유고슬라비아로 통합되었던 곳은 어디야,1
코모로는 어디 있는 나라야,1
축구선수 토마스 뮐러 국적이 어디인지 알려줘,1
모쿄 시에서 상점이나 공장이 집중된 곳은 어디야,1
마이클 라이언이 강의했던 대학들이 어디야,1
마이크로소프트 인포패스는 어디서 처음 공개했지,1
이란의 수도가 어디야,1
준달라의 근거지가 어디야,1
매리너 6호와 7호의 엔지니어링 모델은 어디에 전시되어 있어,1
세계에서 가장 좁은 거리가 어디지,1
1906년 세계박람회는 이탈리아 어디에서 열렸어,1
청두 평원은 어디에 있는 평원이지,1
내셔널 유스 극장이 어디야,1
이탈로 스베조는 어디에 있는 학교에 다녔지,1
HD 212301 b는 수다르스키의 외계 행성 겉모습 분류에서 어디에 속해,1
론 워싱턴은 어디에서 선수생활을 마무리한거야,1
아리스토텔레스는 어디에 학교를 세웠어,1
젝스키스의 소속사가 어디야,1
왕립 모로코 해군의 제1기지는 어디에 있어,1
열린 밸브에서 유체가 어디에서 어디로 흘러,1
일회와 이회 소프트웨어 자유의 날 행사을 지원한 회사가 어디지,1
박찬주가 이사장이었던 학교가 어디야,1
밴드오브브라더스 어디서 만들었어,1
가자 지구는 수자원을 어디에 의존하고 있어,1
로베르트 레반도프스키는 어디서 태어났어,1
일본 전철 유메조라 열차를 운행하는 노선이 어디야,1
금성대군의 신도비는 어디에 있지,1
전국에서 연평균 기온이 가장 높은 지역이 어디야,1
슬로베니아는 1919년에 어디로부터 독립했어,1
서위나라의 수도가 어디야,1
국내에서 다다다 애니 어디서 했어,1
세계에서 당뇨병 발병률이 가장 높은 나라가 어디지,1
디아블로에 나오는 아이단 고향이 어디야,1
북크메르족은 어디 지역에서 거주하는 사람들을 이르는 말이야,1
아나 아말리아는 어디 공비였지,1
정양사 삼층석탑은 어디에 있어,1
V-1 비행폭탄은 어디서 개발한 거야,1
가에타노 시레아는 어디서 교통사고를 당했지,1
최초의 중국 왕조는 어디지,1
주도 제 99호선이 미국 캐나다 국경지대와 어디를 잇고 있지,1
폴 크루그먼이 교수로 재직중인 곳이 어디야,1
지구상에서 제일 작은 나라가 어디야,1
시암스퀘어 쇼핑몰은 어디에 있는거야,1
브라이언 커니핸이 나온 대학교가 어디야,1
걸프 만에서 극장의 전통을 가지고 있는 유일한 나라는 어디야,1
밴 모리슨이 태어난 곳은 어디야,1
축구선수 안토니오 디 나탈레의 출생지는 어디야,1
2000년에 현대 유니콘스 연고지는 어디로 바꼈어,1
안산시의 다문화 특구 지역은 어디야,1
왕조의 세월을 방송한 방송사가 어디야,1
바오닌은 어디 출생이야,1
오스티아 해전은 어디 간의 싸움이야,1
이원정이 지은 시들은 청나라 당대의 유명한 시와 함께 어디에 실렸어,1
어디에서 컴퓨터를 이용한 헤드 마운티드 디스플레이를 처음 만들었지,1
골룸이 사우론에게 잡히게 되는 곳은 어디야,1
중국 축구팀 헝다 연고지가 어디야,1
야구선수 모창민이 졸업한 초등학교가 어디야,1
대다수가 케추아어를 쓰는 지역이 어디야,1
페르디난트 3세는 어디 황제야,1
아티카력을 사용하던 지역이 어디지,1
세계에서 9번째로 큰 나라는어디야,1
야나세 다카시가 태어난 곳이 어디야,1
유럽 솅겐 조약에 예외인 나라가 어디야,1
현재 스테판 커리의 소속팀은 어디야,1
콘위 성이 위치한 곳이 어디야,1
목포 시립 도서관 어디에서 관리해,1
시미즈 다쓰야는 어디에서 태어났어,1
밀레니엄 스타디움을 관리하는 회사는 어디야,1
암술대와 임술머리는 어디에서 형성돼,1
블랙 아프리카에서 처음으로 OPEC에 가입한 나라가 어디야,1
비앙카와 페르난도를 벨리니에게 의뢰한 곳이 어디야,1
수운교 석종은 어디에 있어,1
스코틀랜드의 여왕 메리가 18년동안 유폐 생활을 한 곳이 어디야,1
미국 하와이 주의 주도가 어디야,1
청일전쟁 때 처음으로 공격한 나라가 어디야,1
일본무역진흥기구의 본부는 어디에 있지,1
미나모토노 요리이에가 쇼군직을 박탈당한 후에 유폐된 곳이 어디야,1
나가세 아라시가 다니는 학교가 어디야,1
연방 준비 은행의 본부는 어디에 있지,1
캐드는 어디에 쓰는 프로그램이야,1
기다 이사무가 처음 입단한 프로야구 팀은 어디야,1
인어공주에서 에리얼 목소리는 어디에 있어,1
미디안은 어디 살았었어,1
고토 열도는 어디에 있는 섬들을 말하지,1
조선 세조 때 공보언이 유배된 지역이 어디지,1
쿠르드족은 어디에 살아,1
대한민국 임시정부가 있던 곳은 어디야,1
러시아의 수도는 어디야,1
히드로필룸아과는 주로 어디서 자라지,1
1920년 독일대학우호회는 어디에 설립되었지,1
강세황 본관은 어디야,1
50센트 고향 어디야,1
1988년 하계 올림픽은 어디서 열렸어,1
벨로루시 소비에트 사회주의 공화국이 어디야,1
소하공주는 어디서 발견됐어,1
일본 도매업 연간 판매액 4위인 현이 어디야,1
제이리그 시미즈 에스펄스의 연고지가 어디야,1
북한의 김일성은 어디 출신이야,1
스라소니 복원은 어디서 추진되고 있어,1
밀란 네디치 장군은 어디에서 죽었어,1
톨킨의 호빗을 출판한 출판사가 어디야,1
그레나다의 수도가 어디야,1
쉴레이만 대제의 제국이 어디지,1
터키가 국명분쟁을 벌이고 있는 나라가 어디야,1
소설 시귀 한국어판 출판사가 어디야,1
1920년 하계 올림픽에서 축구 우승 지역은 어디야,1
일본 프로축구팀 우라와 레드 다이아몬즈의 본거지가 어디야,1
예술가 훈데르트바서가 입학한지 하루만에 자퇴한 학교는 어디야,1
1936년 올림픽은 어디서 열렸어,1
마르코판 바스턴은 어디 코치야,1
어디 대학에 안영근이 다녔냐,1
그리스의 스타디온은 어디에 설치됐어,1
마우스 전차에서 전기를 만드는 부분이 어디야,1
남부 판찰라는 어디에 수도가 있는지 알고 싶어,1
젠코지 평야가 어디 있어,1
이와쿠라 히로후미는 2000년 어디에서 중의원 선거에 입후보했어,1
한미FTA 1차 협상은 어디에서 했어,1
붉나무의 이름은 어디서 유래했지,1
프라이트라이너가최초로트럭공장을세운곳은어디야,1
F1 호주 GP의 개최 도시는 어디야,1
동티모르의 수도가 어디야,1
노르웨이의 수도가 어디야,1
피그스 만의 주요 상륙 지점은 어디야,1
형제의 상은 어디에 설치되었지,1
주장 뉴타운에서 규모가 가장 큰 쇼핑몰은 어디야,1
400번대 우편번호가 할당된 지역이 어디야,1
1949년 인민해방군 공격으로 장제스가 도망간 곳이 어디야,1
프라브딘스크는 어디에서 유래한 단어야,1
글래스턴베리 페스티벌은 어디서 열리는 거야,1
아비바 스타디움을 소유하고 있는 연맹은 어디야,1
폴란드 요리에 가장 큰 영향을 끼친 나라가 어디야,1
드라마 도깨비 어디서 방송했어,1
키레네가 지금 어디에 있는지 알아,1
파이브돌스는 어디 소속이야,1
볼로냐의 공식 경기장이 어디야,1
도고는 어디에서 죽었어,1
아랍지역에서 가장 가난한 나라가 어디야,1
노르웨이에 포경기지는 어디에 있어,1
암모니아가 주로 어디에 쓰여,1
동양의 라스베이거스라 불리는 곳은 어디야,1
흰띠쥐캥거루는 어디에 살아,1
수혈 반대하는 종교단체가 어디야,1
과야킬은 어디에 있는거야,1
방정식은 어디서 유래했어,1
2008년 올림픽 야구 우리나라랑 결승에서 붙은 팀이 어디야,1
엑슨모빌이라는 석유회사는 어디 나라의 회사니,1
캄포포르미오 조약의 양 당사자는 어디야,1
서애류성룡함 건조 업체가 어디야,1
울산군립도서관은 어디에 세워져있어,1
토머스 스턴스 엘리엇이 귀화한 나라는 어디야,1
1941년 모사데그가 어디에 억류되었어,1
제주 수산리 곰솔이 있는 곳이 어디야,1
데얀 다먀노비치는 어디서 축구 프로선수 생활을 시작했지,1
타라로는 어디 있는 도시야,1
난카이 전기 철도는 어디 있어,1
제임스 뷰캐넌이 규칙을 어겨서 퇴학을 당한 학교는 어디야,1
서울대 의대가 있는 캠퍼스가 어디야,1
플레이스테이션 4 출시가 미뤄진 나라가 어디야,1
1991년 NBA 우승팀이 어디야,1
바그다드 함락 사건 당시 바그다드는 어디 나라의 영토였어,1
캐드의 첫번째 상용프로그램은 어디에만 사용이 되었지,1
가마쿠라의 정무와 재정을 담당하던 곳이 어디야,1
세계에서 22번째로 큰나라가 어디야,1
난영가요제는 어디서 하는거야,1
백남기 고향이 어디야,1
우루스의 수도가 어디야,1
롯데시티호텔 대전점은 어디에 있어,1
1937년에 인테르나치오날레가 어디랑 경기했어,1
메탈리퍼의 개발사가 어디야,1
최초로 숫자 0을 도입한 나라는 어디야,1
브리타니아라는 이름은 어디에서 따온거야,1
조던 나이트의 날을 선언한 시의회가 어디야,1
우륵이 가야금을 연주하던 곳으로 알려진 충주 명소는 어디야,1
카자흐스탄 수도가 어디야,1
달레이 블린트가 맨유에서 뛰기 전 소속 팀이 어디야,1
데이비드 러셀 롱이가 처음으로 변호사 생활을 시작한 지역은 어디냐,1
돌산도는 어디에 있는거야,1
북촌항은 위치가 어디야,1
주미한국대사관 미국 어디에 있어,1
헤일 망원경 있는 천문대가 어디야,1
문경시청은 어디에 있어,1
1996년 올림픽은 어디서 열렸어,1
신재희의 동생은 어디로 도망갔어,1
리비아의 수도는 어디야,1
모하마드 모사데그는 어디 출신이야,1
김명국의 그림은 어디서 보관하고 있지,1
베트남에서 최고 높은 산은 어디야,1
맷 데이먼이 운영하는 재단이 어디야,1
Felix Baumgartner은 국적이 어디인지 알아봐줘,1
블랙번은 어디서 태어났지,1
체르노빌이 있는 나라는 어디야,1
Yvan Goll의 고향이 어디야,1
효회공주의 본관이 어디지,1
이스라엘에 종교관광지로 유명한 곳이 어디야,1
얀 치홀트의 출생지가 어디야,1
원효는 어디서 태어났어,1
F 5 프리덤 파이터는 어디서 만든거야,1
소설 미야모토 무사시가 연재 된 신문은 어디지,1
히틀러 생가는 어디에 있어,1
이원복의 흉상은 어디 있어,1
더스틴 우드가 이적한 잉글랜드 팀은 어디야,1
우즈베키스탄에서 사람이 가장 많이 사는 지역은 어디야,1
프톨레마이오스 지리학 책에서 축복받은 섬은 어디에 있어,1
독일 연방의회는 어디에 있어,1
밤룽랏 병원은 어디에 있는 병원이야,1
그리스인들은 어디에 고르기아스의 황금 조각상을 세웠지,1
2009년 사회적 비용 부담이 가장 큰 암으로 간암을 지적한 곳이 어디지,1
쇼트트랙 선수 김보름 고향이 어디야,1
무안국제공항은 어디에 위치해있어,1
1927년 쇼팽 국제 피아노 콩쿠르는 어디서 열렸지,1
권동진은 어디에서 수감생활을 하였어,1
일본 사회당이 연립여당으로 참여한 곳은 어디야,1
어디 나라가 알리 아미니의 국적국이니,1
미르 성은 어디에 있는지 알려줘,1
고세이 선의 종점이 어디야,1
남아공에서 바텀라인을 방영하는 채널은 어디야,1
금동보살입상은 어디에 전시되어 있지,1
박근혜가 구속된 구치소가 어디야,1
트라이스타 만든 데 어디야,1
제2차 세계 대전 전범들을 모셔둔 일본의 신사는 어디야,1
오큘러스 리프트를 개발한 회사는 어디야,1
파더보른은 어디쯤 위치해있어,1
프리미어리그 이달의 선수상을 가장 많이 받은 나라는 어디야,1
"프리미어리그에서 1,000골을 달성한 팀은 어디야",1
최형우의 포지션이 어디야,1
